{"schema":"mana.action.receipt/v1","action_id":"act_111111111111111111111111","action":"knowledge-edit","target":{"scope":"project","reference":".mana/global/architecture.md"},"expected_revision":"sha256:1111111111111111111111111111111111111111111111111111111111111111","before_revision":"sha256:1111111111111111111111111111111111111111111111111111111111111111","after_revision":"sha256:2222222222222222222222222222222222222222222222222222222222222222","outcome":"applied","proposal_artifact":null,"details":{},"recorded_at":"2026-09-28T10:00:00Z","guarantees":{"model_calls":0,"network_calls":0,"automatic_promotion":false},"receipt_artifact":"mana-cache://actions/receipts/act_111111111111111111111111.json","receipt_revision":"sha256:3333333333333333333333333333333333333333333333333333333333333333"}
