{"schema":"mana.action.receipt/v1","action_id":"act_222222222222222222222222","action":"knowledge-edit","target":{"scope":"project","reference":".mana/global/architecture.md"},"expected_revision":"sha256:1111111111111111111111111111111111111111111111111111111111111111","before_revision":"sha256:2222222222222222222222222222222222222222222222222222222222222222","after_revision":"sha256:2222222222222222222222222222222222222222222222222222222222222222","outcome":"conflict","proposal_artifact":"mana-cache://actions/conflicts/act_222222222222222222222222.json","details":{},"recorded_at":"2026-09-28T10:01:00Z","guarantees":{"model_calls":0,"network_calls":0,"automatic_promotion":false},"receipt_artifact":"mana-cache://actions/receipts/act_222222222222222222222222.json","receipt_revision":"sha256:4444444444444444444444444444444444444444444444444444444444444444"}
